  no task identifier or boundaries, a first-order method, a single epoch , adapting to the individual environment, Adversarial Training Strategy, alternative greedy method based on heuristic, assigns a semantic label to the class-agnostic instance, auxiliary classification loss, avoid duplication , avoids loss landscape of past data, balance the classifier based on degree of bias, better compression , blurry task boundaries, Bounded Resources, class-incremental learning, class-incremental setting, classification, classification settings, compress dimensional vectors, compressed feature replay at intermediate layers, compute the current predictor, compute the probability of cleanliness per sample, considered  each data sample only once," Contrastive based", control the class distribution in memory well, control the network’s memory footprint, creating a buffer to store data with independent and identical distributions, deep neural networks-based models, distributions might be non-stationary, Diversity-based update mechanism of the replay buffer, dose not require computing the Hessian matrix, dynamically adjust the hyperparameters, effectiveness , end-to-end speech recognition, exploration , fast adapt deep segmentation models, fast training, feature extraction layers, feature extractor, feature transformation strategy, finding better architecture for each instance, freeze the instance head, full exploration of the data stream, fully utilize the image annotations, generate image features, handle streaming data, handling missing labels, handling sequentially, high compression ratio, imbalanced data streams, in-distribution (ID) domain, incremental learning strategy, induce common features , Inference, integrating a text-to-image (T2I) generative mode, intuitive baseline, iteratively update the model parameters., joint training, kNN-based, knowledge distillation, learned and consolidated incrementally, learned task-specific priors, learning and evaluating at any point in time, Learning Componen, learning general representations, less memory requirements, linear time complexity, local-learning rule, loss function, low data regime, maintain a cumulative moving average of the estimated importance weights, maintains a purified replay buffer, maximizing the diversity of samples, measure the relationship between random variables, memory population algorithms, MemoryRetrieva, MemoryUpdate, meta-learning fashion, mitigate erroneous noisy label signals, mitigate forgettin, model parameters are trained, Modeling Task-specific Parameter Distributions, modeling the distribution, more realistic, multi-layer feature extractor, multi-level stacked model, MULTI-LEVEL STORAGE, multiple parameter updates, neuron calibration, Noise induced Amnesia, non i.i.d manner, non-stationary, not single-head setting, Online Adaptation, Online faSt Adaptation and Knowledge Accumulation (OSAKA), online updates , only add/remove nodes, operate on various AI chipsets, orthogonal loss is removed, prevent instabilities in the algorithms, PREVENTING THE INNER OPTIMIZATION BIAS, probabilistic encoder and decoder, raise the standard for high quality evaluation, rapid online learning, reduce the variance of SGD, rehearsal-based incremental learning , reinforcement learning, reservoir sampling strategy, robust pretraining on a dedicated source dataset, shared encoder, simple alogorithm, simple baseline, storage, storage constraints," stronger
compression module based", supervised learnin, synaptic regularization, task-agnostic calibrator, task-free, task-incremental learning problems, to advance compute efficient continual learning, trade-off in quality of information versus the amount of samples stored, train a neural network on the source domain , train neural networks incrementally, train the semantic segmentation head  in a supervised manner, trained jointly, transformation functions, zero stability gap,(online) incremental learning,a better representation of the input samples where similar samples lie close,a fixed storage capacity,a limited buffer to store,a single forward pass,a single pass through data,a trainable soft mask,absence of any prior knowledge regarding the incoming,accommodate online new classes with minimal interference with learned knowledge,accumulate knowledge over time,Accumulate the knowledge of previous classes,achieve a better stability-plasticity trade-of,Achieve better performance,achieve correct outlier detection,achieves dimension reduction,achieves feature approximation,achieves SOTA,achieving strong performance with minimal or no additional cost,Adam optimizer,adapt panoptic segmentation,adapt the network during inference time,adapt the transformation functions in the deep neural network layers,adapt to new knowledge,adaptation of new individual target,adaptation with dynamic data sampling ,adaptive multi-level storage mechanism,adding qualified images into the buffer from streaming data ,"Addressing the risks of continual webly supervised training,",Adjust the coefficient,adjust the frequency dynamically,adjust the hyperparameters ,adopted for MemoryUpdate operation,advantage of unlabeled data,align feature representations ,align features of all tasks,alleviate catastrophic forgetting,alleviate forgetting,alleviate forgetting,alleviate the computational cost,alleviate the forgetting,alleviate the gradient imbalance (CL imbalance) ,alleviate the influence of biased norm,Alleviate the scale to large models,alleviates the drawback of fixing the backbone neural network,alleviating forgetting,allowing knowledge retention,Allows to compress multiple examples into a single one,allows to move the feature replay to lower layers,"allows use of more capacity for harder data, and fewer for easier",alternates between standard-process and intra-process  updates,An Empirical Surrogate to Feasible Region Minimization,anchor size extract,any hold-out data,any-time inference,Anytime evaluation and comparisons of the computation time per incoming  batch,applies product quantization,apture a representative sample from each class in memory,AR applications,architectural-based,assessing image quality ,"associative content-addressable
memory model",autoencode the incoming data with the generator,automatic speech recognition,automatic speech recognition (ASR),automatically sampling,auxiliary classifier,average episodic memory loss does not increase,avoid CF,avoid computing second-order derivative which is computationally inhibitable,avoid exploding model weights,avoid extra computational requirements,avoid forgetting,avoid over-fitting and vanishing gradients,avoiding an increase of memory consumption over time,avoiding overwriting the previous information,Avoiding the need for removing data from the buffer,avoids the high-loss ridge of past tasks,back-end intelligence,backbone,backend to a deep encoder,backpropagation to update the network weights,backward optimization path,Balance diversity and purity in the episodic memory,balance the stability and plasticity,balanced rehearsal distribution,Balances the computational cost of the whole OCL training phase and the degradation of the images in memory,balances the stability-plasticity,balancing the class distribution in memory,based on cluster mean,based on consolidation in a meta-space,based on heuristic,based on rare semantic class sampling and image diversity,based on user feedback,be biased towards the classes with more training samples,be updated in realtime ,better control over the negative transfer,better on small memory size,bi-level optimization problem,BILEVEL LEARNING,blurry task boundaries,buffer can store more data for the same fixed amount of memory,buffer deletion (and insertion) agnostic to the level of the sample,Buffering strategy,build efficient regression models on this search space,build our network ,calculate the training gradients,calculate weights of the images in the buffer,calibrated units under a general formulation,calibrating learned and online information,can be memory-free,can work with or without task information at test time,candidates selecting ,capture the power spectrumchange of different frequency bands,careful update scheme allows for learning incrementally,cast metalearning optimization,Catastrophic forgetting,catastrophic forgetting is significantly mitigated,catastrophic forgetting suppressed,Centrality,centrality-based stochastic graph ensembles,CL memory retrieval,Class Balancing Strategies,class incremental learning setting,class-agnostic,Class-balanced Exemplar Selection,class-incremental learning (class-IL),class-incremental learning tasks,Classes are imbalanced,classification,classification loss to update the model,classifier,classifier cannot leverage the distribution shift,classify the generated features,clustering,Clustering ,clustering approach,clustering based exemplar selection algorithm,clustering the data for each class based on visual similarity,CNN-based ,coefficient learning,collect the statistics,collecting distillation data,combine generic experience replay with additional constraint,Combines re-labeling and unsupervised learning with unreliably labeled examples,commonly used in neuroscience,communicate information forward,comparable running time,Comparison with DualNet-based methods,Compensate the gradient imbalance (GI),competitive learning,Competitive Performance,complement to experience replay,complex datasets,comprehensive knowledge,Compress the memory and achieve a better use of its limited size,compressed feature replay,compute constrained,compute the parameter importance,Computes a more accurate projector,Conditional Computation,confidence-based coreset selection,connectionists architectures,consider limitations on the size of the replay buffer,considerable level of generality,considering the computational cost and delay,Consistency,consistency property,consistent with the MSE cost function,consolidating the predictions of previous samples at each learning step,consolidation in a meta-space of model parameters,constrain the evolution of long-range and short-range spatial relationships at the feature level,constrain the relationship between input and synthetic images,Constraint vs Regularization,Construct an update batch,construct extra constraints,construct source buffer,construct the training data,constructing a fixed-size replay buffer,Constructing Features Constraint,consumes few memory requirements,Continual learning ,continual-meta learning,continually,continually learn,continues to reveal new data,continuously learn novel visual concepts,contrastive training batch,control drift,control the class distribution in memory ,control the representation drift of old classes,control the strength of the regularization,Controllable non-stationarity,controller network,controlling synaptic plasticity,controls what resolution the sample is stored,converges faster,convert a signal in the time domain to the frequency domain (spectrum),converting the common features into the task-specific features,convolutional layers,cop with  background concept drift,cop with class-imbalance simultaneously,"Copy Weight with Reinit (CWR)",correct the signal baseline and eliminate deviationas,cost-effectiveness,creating a proxy for the interference,cross-task class discrimination (CTCD),cross-validate the parameter,custom replay sampling,data arrives in an independent  and identically distributed manner ,data arrives in small batches,data arrives one-by-one,data augmentation on selected exemplar,data augmentation pipeline,data may not be known,data sampling method used,data-incremental learning,deal with the change of probability distribution,decoupling the issue of incremental classification from the one of learning an overall transferable representation,decrease validation accuracy,delivers the final predictions,density-based algorithm,Depth Adaptatio,designed for partly  labeled data,detect the training stage and  judge the balance of the coresets,detects novel activities from streaming sensor data,different memory budgets,directly classifying  fails to fully explore data samples of novel classes.,discrimination for each learned task,discriminator to trained to associate a data sample,disjoin data,distilling the training characteristics,distribute training the individual modules in parallel,divides data into different segments,DNNs can be updated,do  not use additional parameters or fix parameters,do not require knowledge of the current task,do well in single class,does not incorporate any other learnable parameters,does not need to store additional samples,Does not require additional memory to store the output logits,Does not require knowing the total number of data,does not require knowledge of the current task,does not require large batch sizes or negative data,does not require pretraining,domain adaptation,domain adaptation method,domain adaptation method ,domain incremental learning,domain incremental setting,Domain-Incremental setting,dosent store previous data,drawing examples from the memory,dual memory management strategy,dynamic life cycles of classes,dynamic memory,Dynamic representations,dynamic threshold,dynamically,dynamically deciding whether a new memory unit is created,editing the drawn examples,effect freeing memory,effect reducing forgetting,effective for representational drift,effective framework,effective knowledge transfer,effective online learning regime,effectively learn new data,Efficient Computation,Efficient Online Hyperparameter Optimization,efficient semi-distributed associative memory,efficient use of limited model capacity,EfficientlEfficiently learning and generalizing,efficiently fine-tune,efficiently re-use the training data ,efficiently train the model  with a limited memory,eliminate the overlaps,EMBEDDED DEVICES,embeds the class-specific features,employs information entropy,enable the use of knowledge distillation,encode and decode the data samples,encourage the attraction between,encourages fine-tuning,encourages remembering all historical knowledge,encourages the model to learn taskspecific information implicitly,Encouraging Explorations,end-to-end hybrid video surveillance architecture,endto-end ensemble training,enforce the repulsion between different class,engaged in a continuous improvement process,enhanced sample efficiency,ensemble methods,ensembling multiple models at test time,ensembling technique guided by data complexity,ensures more generalization,ensures more reproducibility ,Ensures no interference with tasks that have been learned,establish a fuzzy membership function,estimate the camera motion,estimate the class mean dynamically,estimate the consistency,estimate the individual contribution,estimate the local density of patterns,estimate the norm of the new task loss,estimates the probability of label purity,evaluate memory population,evaluation process iteratively,evaluation protocols: task-aware (TA) and task-free (TF),exceptional suitability,Exemplar selection,exemplar selection algorithm,Exemplar Selection From Clusters,exemplar-free method ,expedited memory consolidation,experience replay,Expert Network,explicitly reducing forgetting,explore the transferability of optimal learning conditions ,explore transfer metalearning across modalities and datasets,Extract feature embeddings of new data,extract generalised useful features,extract the features,extracting a dense feature map,extracts the task-invariant features enabled,faces difficulty in accumulating the knowledge over time,facilitate prototype refinement and calibration,facilitating knowledge transfer,fast adaptation,fast adaptation in a parallel way,faster and lightweight continual learning,feasible parameter space during the optimization trajectory,Feature augmentation,feature calibration,feature extraction,feature optimiser,feature representation layer,feature space is fully differentiable,feature transformation,feed-forward deep neural networks,feed-forward network,feed-forward neural networ,feeding the combined features,fight against the stability plasticity dilemma,fill in the missing annotations,fills in the missing labels,Filter clean data,find the high-performing parameter configuration ,find the high-performing parameter configuration in this mixed search space,flexible,focus on training at the mini-batch level,focuses on the current task,focuses on the previous tasks,food image classification,forward inference path,forward transfer,freeze the parameters,freezing the backbone network ,front-end intelligence,full data is available,fully connected layers,fully differentiable ensemble method ,generate pseudo-labels,generate task-invariant features,generate the class prediction scores,generate the task labels,Generates a more discriminative classifier,generates the configuration to evaluate in the mixed search space,generates the scaling and shifting coefficients,generating indistinguishable features,good performance in the single pass setting,gradient based optimization,Gradient Imbalance due to CL Imbalance,Gradient Imbalance due to Data Imbalance,Gradient-Based,gradient-based sample selection strategy,great balance between preventing catastrophic forgetting and facilitating learning,greedy algorithm ,greedy selection,"growth of buffer size further improve
the performance of PCR",guarantees the same number of training samples for each class in each training iteration,handle data streams,handles the  information in a hierarchical manner with different stages of  information,has better guaratees in terms of average accuracy ,has occlusions in objects and a natural distribution,having a shallow network,high compression rates,hyper-parameter selection,identify optimal configurations for each case,image classification,imbalanced,imitate the predictions of the past model,imposed memory constraints,improve accuracy,improve computational efficiency,improve information retention,improve performance,improve performance,improve sleepquality assessment accuracy,improve the informativeness of the auxiliary memory,Improve the performance without requiring additional storage,improved storage of previous data,improves the baselines by large margins,improving generalization,in a fixed location,Incoming data add to storage,incorporate synaptic plasticity mechanisms,incremental classification,incremental learning environment,incremental model updates ,incrementally learning a deep segmentation network,incurin less violations,independent and identically distributed(iid),inference,inference,inference,influencing both their forward inference path and backward optimization path,Inner-Update,instance awareness,Instance stream rather than task stream,instance streams are the only data source for both the training and the evaluation,instance-based streaming,Integer Quadratic Programming,integrate the information ,integrates an iterative relabeling strategy,integrates dynamic sampling and pixel relabeling,integrating both processing and learning into the networks,intermediary classification,intermediate process of training sample,intervene in the update of network parameters in the current task,introduces a simple mechanism for memory consolidation,is just an inner product,is suitable for long task sequences,is trained to maximize,is trained to minimize,isotropic multivariate Gaussian,its application is ideal for the OCL,Joint Distribution Estimation,joint monocular depth estimation,jointly train all layers after the replay layer,jointly train phase,just needs the gradient of a random subset of memory examples,keep a small part of samples from the data stream in memory,keep important information,keeping diverse examples,Keys and classifiers,knowledge distillation,knowledge distillation on augmented exemplars,knowledge retention,knowledge sharing across tasks,latent representations,Learn a discriminative classifier for each new task,learn a task-specific parameter distribution,learn from a continuous stream,learn more generalised representations,learn more robust ,learn the predictions of the previous model’s intermediate representations.,learn to compress and store,learned the distribution to generate model parameters ,"learner does not have access to
the task identifier t at inference time",Learning Calibration Parameters,learning new tasks,Learning rate Scheduling,"learns
to scale the weights",learns more holistic/comprehensive features,learns the global task distribution,learns to scale the output feature maps predicted by the transformation function,leverages multi-level representations produced ,"Leveraging concept-wise harder generated samples, determine",lightweight,lightweight network architecture,limit the interference,limited extra computational overhead,LONG-TAILED ONLINE CONTINUAL LEARNING,low computational complexity,low running times,low storage requirements,maintain both summarized and original samples.,maintain recognition ability for the old classes,"maintain the angular distance between the samples of
consecutive tasks",maintaining class balance in the buffer,maintaining low computational overhead,maintaining quality and maximizing memory usage,maintaining strong classification performance,maintaining the classification characteristics of the replayed features,"maintaining the generalization capacities of
distributed networks",make a balance between stability and plasticity,"make an tradeoff between the current knowledge and the previous knowledge to remove the imbalance between the
current task and the previous task data",make the buffer more balanced,make the representations of dual view image pairs consistent,make the right balance between plastic and stability in ocl,Makes the external memory condensation more efficient and scalable to OCL,matching the logits and features,maximizes  image diversity,mechanism of selecting paths,memorize the facts and experiences,memory constrained,memory efficient,memory examples remain in distribution ,memory indexing,memory management,Memory Only Training,memory population approach,Memory pruning ,memory retrieval,memory update,memory usage,memory writing rule,Memory-Constrained Online Continual Learning (MC-OCL),Memory-efficient,MemoryRetrieval,MemoryUpdate,meta-consolidation phase,meta-distribution of model parameters,meta-learning,meta-learning perspective,minibatch of trainin,minimal-prerequisite scenario,minimize an entropy penalty,minimize the distance between the memory and the original data,minimizing the difference of global statistics at various  feature levels between the new and old model,minimizing the distance in parameter spac,"mitigate the influence of the resulting imbalance
later",mitigating catastrophic forgetting ,Mixed-Integer Optimization Framework,model spatiotemporal context for online contextualized few-shot learning,models are ensembled,more informative samples,multi-context feature map,multi-head classifiers,multi-head setting,multi-incremental-task (MIT),MULTI-LEVEL RESERVOIR SAMPLING,multi-task (MT),Multilayer ,multiple learning algorithms,multiple replay iterations,multiple updates,Multiple Updates for Incoming Samples,needs no extra memory,needs to update the memory,neural architecture,Neuromodulated Architecture,never forgets,new combination of three loss function,no assumption on order of data presentation,no assumption on task boundaries,no assumption on the distribution,no task boundary,no task or class boundaries,Noisy Labeled Continual Learning,non-i.i.d input distributions,Non-i.i.d settings,non-stationarity,non-stationary data streams,non-stationary distribution ,not define clear task boundaries,not rely on the oracle of task boundary,not sensitive to different settings of hyperparameters. ,number of different tasks,"number of generated clusters are
not set beforehand",object  detection ,obtain discrete latent representations,obtain new knowledge from incoming tasks,obtain the most clean samples,obtaining the optimal solution,offer the theoretical guarantees of convergence and generalization,offline consolidation,offline memory consolidation,on-device learning,oncatenate the incoming mini-batch with the retrieved mini-batch,one epoch setting,one-epoch,one-pass stream of sample,online,online (one-epoch) task-incremental learning,online class incremental continual learning,"ONLINE CLASS-INCREMENTAL
CONTINUAL LEARNING",online class-incremental CL setting,online class-incremental continual learning,online class-incremental setting,online continual classification of images,Online Continual Compression,online continual generative modeling,online continual learne,online continual learning on an unseen target domain,online continual learning setting,online continual visual learning ,online learning,online learning rate algorithms,online manner,online nonincremental task ,Online Sample Selection,online scenario,online task-agnostic continual learning,online task-free continual learning,ONLINE TASK-INCREMENTAL CONTINUAL LEARNING,online training regime,only observing each sample once,only storing features,only the most salient features are included in the representation,only two layers ,optimal learning,optimally sample training data from generated data,Optimization Objective Function,optimization problem,optimization process to train the calibrated model,optimize storage and sampling,optimize the loss on the current example(s) without increasing the losses on the previously learned examples,optimizethe model’s confidence threshold value,order agnostic,out-of-distribution (OOD) domain,outlier detection  on a small batch,outputs of the last fully connected layer,overcame forgetting,overcome forgetting,overlapping clusters of representations,Panoptic Adaptation,parameter updating,parameterizes multiple synaptic plasticity mechanisms,Past-assisted Summarizing,Performance,performing rehearsal on the buffer,pixel-wise semantic labeling of images,plasticity,plasticity,playing an adversarial game,portability,potentially lead to improved performance,practical continual learning,pre-train phase,pre-train the meta-graph,pre-trained,pre-training strategies ,predict the activity labels provided in the initial data,predicted probability of the ground truth label,prediction,prediction on a small batch,prediction weighting strategy,prepare a meta-graph,preserve knowledge at different feature levels,preserve latent decision boundaries,preserve the information of instances,Preserves a set of training examples that are diverse and pure,preserving old information,preserving previous information without example buffers,preserving the ability to solve old tasks,pretrained feature extractor,preventing imbalance,prevents the model from adapting to new data,prevents the problem of label shifts ignored ,previous prediction of the model and transfer the past knowledge,privacy preserving,Privacy-preserving,private data to learn,Processing Component,produces the segmentation score map,Product Quantization(PQ),promote consistency with past tasks,promote diversity,Protects the learned knowledge,protects the learned knowledge for the previous tasks,provide a generalized feature network for future inputs,provides a more accurate estimation of the whole space,provides more advantageous and diverse cross-informatio,proxy based,purity aware sampling,pushes away the new task  information,quantize encoder outputs,Quantized exemplars,quantized latent rehearsal scheme,quick integration of information,random sampling,random transform ,rapid online updates,Rapidly adapt to the new task,rather simple,raw data are retrieved randomly,re-occurrence,real-time,Real-time  learning,real-time capable setting,real-time requirements,real-world applications,real-world domains,rebalance contrastive learning between new and past classes,receives aggregated features,receives real-time feedback,reconstruct dimensional vectors,Reduce forgetting even with noisy labels,reduce forward comparability,reduce the change in important weights,reduces feature bias caused by cross entropy,Reduces feature bias caused by cross entropy (CE),reduces the memory usage,reduces the overlapping among invalid bounding boxes,reducing forgetting issues,reducing representation drift of previously observed data,reduction in this representation drift,reduction Representation drift,reflect the changes in data distribution,regularize the network parameter,regularize the parameter update,regularize the training loss,regularizes forgetting,regulates synaptic plasticity,rehearsal imbalance,rehearsal phase,Rehearsal to mitigate forgetting in online case,rehearse for retaining,rehearse for retaining and calibrating learned and online information,related to the Complementary Learning Systems (CLS),relation between samples across tasks,Relationship matching,reliable object detection,relies on locally distributed,relieve the stability-plasticity dilemma,replace the samples of anchorto-sample pairs by proxies,Replay based,replay buffer size adaptation algorithms,replay-based,replaying the edited examples,Representation drift  in OCL,Reservoir sampling,reservoir sampling,Response-Based Matching,restricting the gradient updates,retain information from previous samples and tasks,retain instance memory,retain task memory,retain the information among tasks,retain the information among tasks,retain useful learned  knowledge,retention of old knowledge,retrieve the interfered samples from the previous history for the function being learned,robust,robust against the catastrophic forgetting problem,robust to adaptation,robust training procedure,run independently as part of a data collection,sample compression,sample efficiency issue,Sample Selection as Constraint Reduction,sampled without replacement,samples of data stream  are seen only once,samples selection,sampling from memory,save more feature exemplars,"save the
past data",scalability,scalable,schedule-robust classifier,schedule-robust predictor,scores memory data samples,scores memory data samples ,search over a design space,second best algorithm across all memory configurations,Select exampler,select the same number of samples,"selecting suitable images
from the memory to replay",selecting suitable images from the buffer to replay during training,selection of stored samples,selective sampling ,selective sampling strategy,"self-supervised learning
(SSL) ","self-supervised learning
(SSL)",self-supervised replay technique,semantic segmentation,separation of the latent samples and the task parameters,set the target class distribution in memory,shared head,Shared output heads,shuffled data,simple baseline,simpler,single data pass,single discriminator,single discriminator is updated,single hyperparameter,single recurrent network architecture,single task,single-head  evaluation,single-head classifier in the domain-incremental learning,Single-head evaluation,single-head setting,single-incremental-task (SIT),skip more training samples,slow learner,Small episodic memory,solid angle minimization problem,solve convex constraint optimization problems,Solve the matrix-invertibility problem,Source Domain Pretraining,source-free setting,sparse projection (SPARSE) of the N-dimensional ,specific hyperparameters,split a dataset iteratively,squeeze out more valuable information and effectively,stability,stability-plasticity trade-off,stability-plasticity trade-off online,stabilize our training process,starting learning the new task on the current batch,Static storage requirement,"store an independent and identically distributed
(iid)",store and  compress incoming memories,store feature embedding,store the classes informations,store the corresponding logits and feature and previous raw samples,store the most representative data,stored in a low-dimensional vector,streams ordered by category,strengthens supervision to consolidate previous knowledge,Studied the relationship between the solid angle and the surrogate function,suitable for handling concept drift problems in on-line environments,suitable for long task sequences,suitable for long task sequences achieving strong performance with minimal or no additional cost,Summarize Stream Data,Summarize the knowledge ,Summarizing model training,superior accuracy,supervised,supervised learning rules,synthetic image,Task agnostic,Task Agnostic Setting,task boundaries are blurry or data are imbalanced,task boundary detection,Task Descriptors,task-agnostic evaluation,task-agnostic inference,Task-Agnosticism,task-aware inference,task-free,task-free online class incremental setup,Task-free setting,Task-incremental (task-IL) Learning,task-incremental scenario,Task-incremental setting,task-invariant features enabled ,task-label inference for hybrid task-free classifiers,task-specific heads,temporal ensembling methods,"temporally correlated
streams",tends to have higher intrinsic dimension,the ability to retain previous knowledge,The best trade-off between accuracy and efficiency,The forgetting of outdated classes is encouraged,the generic feature bank,the inner loss function achieves better performance,the multi-armed bandit framework,the objective for optimizing information retention,the overfitting feedback,the proportion of samples with multiple labels in the data streams is high,the single-pass data stream fails to gradually update the prototypes and network parameters,The training process is controlled,The training process of the parameter generator ,The weights to decide the final prediction,to address dilemma that selects the examples with low diversity,to address the underfitting-overfitting dilemma,top performance,top-down concept of augmenting the context,Trade-off between diversity and purity,train parts of the model ,train projection head,train task-specific classification models,train the depth estimation head in a unsupervised maner,training,training an intermediate classifier,training can be done in multiple epochs,training data available incrementally ,"training procedure
specialized ",training process,training the instance segmentation head,training the sequential tasks,Training the VAE,transfer knowledge,transfer metalearning ,transfer of knowledge learned,transfer training the whole network,transferring network weights without domain classification,transferring the knowledge between tasks,transform time domain signals into the power spectrum,true continuous inference,tune the hyperparameters,tune the learning rate as a function of time,two-component loss,under restricted memory size,understanding the individual,unified learning strategy,unified loss,uniform  probability distribution across all samples,unknown task boundaries,unstable,unsupervised,unsupervised learning,update a replay memory,update importance weights,update memory,update the classifier,update the network parameters with respect to the new task while preserving the knowledge of the previous tasks,update the parameter generator,update the parameters,Update the replay buffer,update the weights,update the weights decoders only,updated fewer times,updating of the memory,updating the network weights,use more past knowledge to prevent interference,Use the knowledge of task boundaries to select the representative examples,uses one retrieved mini-batch to compute the generic loss and logits loss,"visual-inertial
odometry",Voting layer,VQ-VAEs,vulnerable to catastrophic interference between recent samples and previous samples,wake/sleep framework for training,weight sharing ,Weighted Random Replay,weights are automatically  assigned to each image in the memory,with limited training data,without  assumptions about labels without the need for task labels,without a memory buffer,"without an encoder
front-end",without catastrophic forgetting,without explicit data storage,without requiring to store all the augmented images,without revisiting,without the notion of clearly delineated tasks setting,work well with limited data,yielding high compression
,,,,,,,,,,,,,1,,,,,,,,,,,,,,,,,,,,,,,,,,,,,,,,,,,,,,,,,,,,,,,,,,,,,,,,,,,,,,,,,,,,,,,,,,,,,,,,,,,,,,,,,,,,,,,,,,,,,,,1,,,,,,,,,,,,1,,,,,,,,,,,,,,,,,,,,,,,,,,,,,,,,,,,,,,,,,,,,,,,,,,,,,,,,,,,,,,,,,,,,,,,,,,,,,,,,,,,,,,,,,,,,,,,,,,,,,,,,,,,,,,,,,,,1,,,,,,,,,,,,,,,,,,,,,,,,,,,,,,,,,,,,,,,,,,,,,,1,,,,,,,,,,,,,,,,,,,,,,,,,,,,,,,,,,,,,,,,1,,,,,,,,,,,,,,,,,,,,,,,,,,,,,,,,,,,,,,,,,,,,,,,,,,,,,,,,,,,,,,,,,,,,,,,1,,,,,,,,,,,,,,,,,,,,,,,,,,,,,,,,,,,,,,,,,,1,,,,,,,,,,,,,,,,,,,,,,,,,,,,,,,,,,,,,,,,,,,,,,,,,,,,,,,,,,,1,,,,,,,,,,,,,,,,,,,,,,,,,,,,,,,,,,,,,,,,,,,,,,,,,,,,,,,,,,,,,,,,,,,,,,,,,,,,1,,,,,,,,,,,,,,,,,,,,,,,,,,,,,,,,,,,,,,,,,,,,,,,,,,,,,,,,,,,,,,,,,,,,,,,,,,,,,,,,,1,,1,,,,,,,,,,,,,,,,,,1,,,1,,,,,,,,,,,,,,,,,,,,,,,,,,,,,,,,,,,,,,,,,,,,,,,,,,,,,,,,,,,,,,,,,,,,,,1,1,,,,,,,,,,,,,,,,,,,,,,,,,,,,,,,,,,,,,,,,,,,,,,1,,,,,,,1,,1,,,,,,,,,,,,,,,,,,,,,,,,,,,,,,,,,,,,,,1,,,,,,,,,,,,,,,,,,,,,,,,,,,,,,,,,,,,,,,,,,,,,,,,,,,,,,,,,1,,,,,,,,,,1,,,,,,,,,,,,,1,,,,,,,,,,,,,,,,,,,,,,,,,,,,,,,,,1,,,,,,,,,,,,,,,,,,,,,,,,,,,,,,,,,,,,,,,,,,,,,1,,,,,,,,,,,,,,,,,,,,,,,,,,,,,,,,,,,,,,,,,,,,,,,,,,,,,,
